{
  "html_path": "output/index.html",
  "asset_paths": [
    "output/assets/analog-clock-body.png",
    "output/assets/cta-start.png",
    "output/assets/cta-to-repair.png",
    "output/assets/desk-clock-body.png",
    "output/assets/feedback-stamp-correct.png",
    "output/assets/feedback-stamp-wrong.png",
    "output/assets/junior-confident.png",
    "output/assets/junior-success.png",
    "output/assets/librarian-celebrating.png",
    "output/assets/librarian-explaining.png",
    "output/assets/librarian-idle.png",
    "output/assets/librarian-worried.png",
    "output/assets/library-dialogue-board.png",
    "output/assets/library-feedback-board.png",
    "output/assets/library-lobby-messy.png",
    "output/assets/main-title-lettering.png",
    "output/assets/number-card-face.png",
    "output/assets/students-happy.png",
    "output/assets/students-puzzled.png"
  ],
  "implemented_sections": [
    "activity1-title",
    "activity1-problem",
    "activity1-tutorial",
    "activity1-success"
  ],
  "implemented_interactions": [
    "start-mission",
    "open-lesson-menu",
    "debug-jump-scenes",
    "continue-intro",
    "solve-tutorial-clock",
    "go-to-repair"
  ]
}
