{
  "html_path": "output/index.html",
  "asset_paths": [
    "output/assets/analog_clock_body.webp",
    "output/assets/bg_messy_lobby.webp",
    "output/assets/bg_messy_lobby_blur.webp",
    "output/assets/bg_restored_lobby.webp",
    "output/assets/child_confused.webp",
    "output/assets/child_idle.webp",
    "output/assets/child_success.webp",
    "output/assets/cork_timetable_board.webp",
    "output/assets/final_certificate_frame.webp",
    "output/assets/large_clock_body.webp",
    "output/assets/lending_system_monitor.webp",
    "output/assets/librarian_applauding.webp",
    "output/assets/librarian_distressed.webp",
    "output/assets/librarian_explaining.webp",
    "output/assets/magic_popup_book.webp",
    "output/assets/popup_book_page_store.webp",
    "output/assets/popup_book_page_sundial.webp",
    "output/assets/popup_book_page_timer.webp",
    "output/assets/popup_quiz_paper_card.webp",
    "output/assets/reusable_library_ticket_button.webp",
    "output/assets/signboard_broken_time.webp",
    "output/assets/speech_bubble_blank.webp",
    "output/assets/time_quiz_control_console.webp",
    "output/assets/title_mission_banner.webp",
    "output/assets/tutorial_repair_workbench.webp"
  ],
  "implemented_sections": [
    "activity1_scene1_title",
    "activity1_scene2_intro_problem",
    "activity1_scene3_tutorial",
    "activity1_scene4_success",
    "activity2_global_ui",
    "activity2_scene1_type_a",
    "activity2_scene2_type_b",
    "activity2_scene3_type_c",
    "activity2_scene4_repair_complete",
    "activity3_scene1_real_life_history",
    "activity3_scene2_popup_quiz",
    "activity3_scene3_final_certificate"
  ],
  "implemented_interactions": [
    "interaction_start_to_intro",
    "interaction_hamburger_menu",
    "interaction_energy_progress",
    "interaction_spinning_clock",
    "interaction_tutorial_drag_clock",
    "interaction_go_to_step2",
    "interaction_type_a_choice",
    "interaction_type_b_keypad",
    "interaction_type_b_choice",
    "interaction_type_c_drag_blocks",
    "interaction_type_c_keypad",
    "interaction_type_c_choice",
    "interaction_library_restore",
    "interaction_go_to_step3",
    "interaction_gallery_pages",
    "interaction_popup_quiz",
    "interaction_final_celebration",
    "interaction_save_certificate",
    "interaction_next_mission"
  ]
}
