{
  "html_path": "output/index.html",
  "asset_paths": [
    "output/assets/bg-library-messy.png",
    "output/assets/bg-library-clean.png",
    "output/assets/bg-type-a-desk.png",
    "output/assets/bg-type-b-wall.png",
    "output/assets/bg-type-c-desk.png",
    "output/assets/title-mission-lettering.png",
    "output/assets/library-clock-body.png",
    "output/assets/librarian-distressed.png",
    "output/assets/librarian-explaining.png",
    "output/assets/librarian-praising.png",
    "output/assets/child-idle.png",
    "output/assets/child-success.png",
    "output/assets/child-thinking.png",
    "output/assets/child-proud.png",
    "output/assets/display-board-surface.png",
    "output/assets/schedule-corkboard-surface.png",
    "output/assets/loan-monitor-surface.png",
    "output/assets/storybook-page-convenience.png",
    "output/assets/storybook-page-sundial.png",
    "output/assets/storybook-page-oven.png",
    "output/assets/certificate-paper.png",
    "output/assets/cta-library-ticket-states.png",
    "output/assets/compact-choice-plaque-surface.png",
    "output/assets/clock-choice-plaque-surface.png",
    "output/assets/feedback-correct-stamp.png",
    "output/assets/feedback-wrong-stamp.png",
    "output/assets/step2-title-banner-surface.png",
    "output/assets/keypad-library-console-surface.png"
  ],
  "implemented_sections": [
    "activity1_title",
    "activity1_problem",
    "activity1_tutorial",
    "activity1_success",
    "activity2_global_rules",
    "activity2_type_a",
    "activity2_type_b",
    "activity2_type_c",
    "activity2_outro",
    "activity3_storybook",
    "activity3_quiz",
    "activity3_certificate"
  ],
  "implemented_interactions": [
    "start_activity1",
    "clock_hand_spin",
    "offer_help",
    "tutorial_clock_answer",
    "clock_hand_state",
    "tutorial_complete_auto",
    "energy_gauge_update",
    "enter_activity2",
    "apply_activity2_global_rules",
    "open_lesson_menu",
    "type_a_answer",
    "type_a_question_swap",
    "type_a_complete_auto",
    "type_b_keypad_answer",
    "type_b_choice_answer",
    "type_b_question_swap",
    "type_b_complete_auto",
    "type_c_drag_answer",
    "type_c_choice_answer",
    "type_c_question_refresh",
    "type_c_complete_auto",
    "restore_library",
    "enter_activity3",
    "storybook_page_turn",
    "storybook_complete",
    "popup_quiz_answer",
    "quiz_complete_auto",
    "certificate_save_inert",
    "next_mission_inert"
  ]
}
