{
  "html_path": "output/index.html",
  "asset_paths": [
    "output/assets/bg-broken-wall.webp",
    "output/assets/bg-finished-mural.webp",
    "output/assets/bg-repaired-wall.webp",
    "output/assets/bg-safe-street.webp",
    "output/assets/bg-wall-closeup.webp",
    "output/assets/completion-emblem.webp",
    "output/assets/feedback-correct-stamp.webp",
    "output/assets/feedback-wrong-stamp.webp",
    "output/assets/intro-title.webp",
    "output/assets/paint-can-body.webp",
    "output/assets/sign-circle-car.webp",
    "output/assets/sign-square-parking.webp",
    "output/assets/sign-triangle-work.webp",
    "output/assets/student-boy-agreeing.webp",
    "output/assets/student-boy-ready.webp",
    "output/assets/student-girl-agreeing.webp",
    "output/assets/student-girl-ready.webp",
    "output/assets/teacher-explaining.webp",
    "output/assets/teacher-idle.webp",
    "output/assets/worker-assistant-idle.webp",
    "output/assets/worker-lead-apologetic.webp",
    "output/assets/worker-lead-explaining.webp",
    "output/assets/worker-lead-idle.webp"
  ],
  "implemented_sections": [
    "intro",
    "shape-hunt",
    "shape-count",
    "activity-one-bridge",
    "paint-ten",
    "addition-build",
    "subtraction-build",
    "random-practice",
    "free-drawing",
    "math-story",
    "completion"
  ],
  "implemented_interactions": [
    "intro-dialogue-start",
    "intro-next",
    "shape-hunt-quiz",
    "shape-hunt-complete",
    "shape-count-keypad",
    "shape-count-complete",
    "activity-one-next",
    "paint-ten-keypad",
    "paint-ten-complete",
    "addition-keypad",
    "addition-complete",
    "subtraction-keypad",
    "subtraction-complete",
    "random-practice-quiz",
    "random-helper-toggle",
    "random-practice-complete",
    "drawing-tool",
    "drawing-confirm",
    "math-story-pages",
    "math-story-complete",
    "certificate-download",
    "exit-content"
  ]
}
