{
  "html_path": "output/index.html",
  "asset_paths": [
    "output/assets/certificate-sheet.webp",
    "output/assets/checkout-terminal.webp",
    "output/assets/clock-body.webp",
    "output/assets/cork-schedule-board.webp",
    "output/assets/feedback-stamp-correct.webp",
    "output/assets/feedback-stamp-wrong.webp",
    "output/assets/junior-librarian-hero.webp",
    "output/assets/junior-librarian-idle.webp",
    "output/assets/junior-librarian-success.webp",
    "output/assets/junior-librarian-thinking.webp",
    "output/assets/librarian-explaining.webp",
    "output/assets/librarian-praising.webp",
    "output/assets/librarian-worried.webp",
    "output/assets/library-disordered.webp",
    "output/assets/library-restored.webp",
    "output/assets/library-time-board.webp",
    "output/assets/mission-title.webp",
    "output/assets/story-page-convenience.webp",
    "output/assets/story-page-oven.webp",
    "output/assets/story-page-sundial.webp"
  ],
  "implemented_sections": [
    "a1_title",
    "a1_problem",
    "a1_tutorial",
    "a1_success",
    "a2_global_ui",
    "a2_type_a",
    "a2_type_b",
    "a2_type_c",
    "a2_outro",
    "a3_story_gallery",
    "a3_popup_quiz",
    "a3_certificate"
  ],
  "implemented_interactions": [
    "start_lesson",
    "lesson_menu",
    "energy_progress",
    "clock_state_controller",
    "tutorial_clock_drag",
    "go_to_repairs",
    "type_a_clock_quiz",
    "type_b_keypad_quiz",
    "type_b_choice_quiz",
    "type_c_number_drag",
    "type_c_choice_quiz",
    "library_restore_animation",
    "go_to_story",
    "story_gallery",
    "popup_quiz",
    "certificate_stats",
    "save_certificate",
    "next_lesson_route"
  ]
}
