{
  "html_path": "output/index.html",
  "asset_paths": [
    "output/assets/bg_museum_exterior.webp",
    "output/assets/bg_museum_interior.webp",
    "output/assets/title_lockup.webp",
    "output/assets/child_speaking.webp",
    "output/assets/curator_explaining.webp",
    "output/assets/admission_sign.webp",
    "output/assets/wallet_money_kit.webp",
    "output/assets/museum_newspaper.webp",
    "output/assets/place_value_rack.webp",
    "output/assets/moon_jar.webp",
    "output/assets/buddha_statue.webp",
    "output/assets/story_population.webp",
    "output/assets/story_distance.webp",
    "output/assets/story_sales.webp",
    "output/assets/story_views.webp",
    "output/assets/completion_badge.webp",
    "output/assets/certificate_paper.webp",
    "output/assets/stamp_correct.webp",
    "output/assets/stamp_wrong.webp",
    "output/assets/museum_payment_counter.webp",
    "output/assets/museum_question_board.webp",
    "output/assets/museum_answer_tile.webp",
    "output/assets/museum_header_plaque.webp"
  ],
  "implemented_sections": [
    "s1-title",
    "s1-greeting",
    "s1-admission",
    "s1-fare",
    "s2-ten-thousand",
    "s2-interior",
    "s2-newspaper",
    "s2-write-150000",
    "s3-write-38077",
    "s3-read-ox",
    "s3-place-value",
    "s4-dialogue",
    "s4-eok",
    "s4-moon-jar",
    "s4-buddha",
    "s5-dialogue-intro",
    "s5-jo",
    "s5-check-dialogue",
    "s5-true-false",
    "s6-skip-ten-thousand",
    "s6-skip-eok",
    "s6-wrap-dialogue",
    "s6-story-entry",
    "s7-population",
    "s7-distance",
    "s7-sales",
    "s7-views",
    "s8-complete",
    "s8-certificate"
  ],
  "implemented_interactions": [
    "topbar-controls",
    "debug-jumper",
    "start-button",
    "scene-next",
    "money-drag-drop",
    "card-drag-drop",
    "keypad-entry",
    "choice-quiz",
    "quiz-submit",
    "feedback-layer",
    "second-wrong-hint",
    "randomize-question",
    "story-carousel-next",
    "certificate-open",
    "certificate-save",
    "certificate-close",
    "exit-lesson",
    "next-lesson"
  ]
}
