{
  "html_path": "output/index.html",
  "asset_paths": [
    "output/assets/bg-school-gate.webp",
    "output/assets/bg-wall-activity.webp",
    "output/assets/bg-school-street.webp",
    "output/assets/teacher-idle.webp",
    "output/assets/teacher-explaining.webp",
    "output/assets/worker-apologizing.webp",
    "output/assets/worker-explaining.webp",
    "output/assets/boy-idle.webp",
    "output/assets/boy-helping.webp",
    "output/assets/girl-idle.webp",
    "output/assets/girl-helping.webp",
    "output/assets/paint-can-body.webp",
    "output/assets/road-sign-round.webp",
    "output/assets/road-sign-square.webp",
    "output/assets/road-sign-triangle.webp",
    "output/assets/stamp-correct.webp",
    "output/assets/stamp-wrong.webp",
    "output/assets/surface-speech-bubble-school.webp",
    "output/assets/surface-info-board-mural.webp",
    "output/assets/keypad-console-paint-counter.webp",
    "output/assets/cta-activity-mural-worktag.webp",
    "output/assets/overlay-shape-find-school-objects.webp",
    "output/assets/overlay-damaged-school-wall.webp",
    "output/assets/surface-choice-plaque-mural.webp",
    "output/assets/surface-free-draw-wall-frame.webp",
    "output/assets/surface-free-draw-tool-console.webp"
  ],
  "implemented_sections": [
    "intro",
    "shape-find",
    "shape-count",
    "shape-transition",
    "ten-intro",
    "addition",
    "subtraction-intro",
    "subtraction",
    "random-practice",
    "free-draw",
    "math-story",
    "completion"
  ],
  "implemented_interactions": [
    "topbar-controls",
    "intro-story",
    "intro-advance",
    "shape-find-hotspots",
    "shape-find-advance",
    "shape-count-keypad",
    "shape-count-advance",
    "shape-transition-advance",
    "ten-keypad",
    "ten-intro-advance",
    "addition-keypad",
    "addition-advance",
    "subtraction-intro-keypad",
    "subtraction-intro-advance",
    "subtraction-keypad",
    "subtraction-advance",
    "random-practice-quiz",
    "random-hint",
    "random-practice-advance",
    "free-draw-tool",
    "free-draw-confirm",
    "math-story-carousel",
    "math-story-advance",
    "download-certificate",
    "exit-content"
  ]
}
