{
  "html_path": "output/index.html",
  "asset_paths": [
    "output/assets/activity-cta-body.png",
    "output/assets/completion-cta-body.png",
    "output/assets/cta-intro-body.png",
    "output/assets/feedback-stamp-correct.png",
    "output/assets/feedback-stamp-wrong.png",
    "output/assets/global-hud-frame.png",
    "output/assets/overview-mural-triptych-frame.png",
    "output/assets/paint-can-body.png",
    "output/assets/road-sign-body.png",
    "output/assets/school-road-background.png",
    "output/assets/school-speech-bubble-body.png",
    "output/assets/school-title-banner-body.png",
    "output/assets/school-wall-closeup.png",
    "output/assets/school-wall-completed.png",
    "output/assets/school-wall-damaged.png",
    "output/assets/school-wall-drawing.png",
    "output/assets/school-wall-problem-scene.png",
    "output/assets/school-wall-repaired.png",
    "output/assets/school-wall-second.png",
    "output/assets/school-wall-wide.png",
    "output/assets/school-yard-shape-search.png",
    "output/assets/shape-tile-body.png",
    "output/assets/story-roadside-info-board.png",
    "output/assets/student-idle.png",
    "output/assets/student-thinking.png",
    "output/assets/student-volunteer.png",
    "output/assets/tap-hint-hand.png",
    "output/assets/teacher-explaining.png",
    "output/assets/teacher-idle.png",
    "output/assets/teacher-praising.png",
    "output/assets/wall-choice-plaque-body.png",
    "output/assets/worker-apologizing.png",
    "output/assets/worker-explaining.png",
    "output/assets/worker-idle.png"
  ],
  "implemented_sections": [
    "section_global_ui",
    "section_intro",
    "section_shape_find",
    "section_arithmetic_tutorial",
    "section_random_problems",
    "section_free_drawing",
    "section_math_story",
    "section_completion"
  ],
  "implemented_interactions": [
    "interaction_global_navigation",
    "interaction_goal_transition",
    "interaction_intro_sequence",
    "interaction_shape_scene_select",
    "interaction_shape_count_keypad",
    "interaction_feedback_reveal",
    "interaction_stage_transition",
    "interaction_arithmetic_keypad",
    "interaction_shape_add_remove",
    "interaction_random_problem_engine",
    "interaction_choice_problem",
    "interaction_optional_help",
    "interaction_shape_drawing",
    "interaction_drawing_confirmation",
    "interaction_sign_story",
    "interaction_certificate_download",
    "interaction_next_lesson",
    "interaction_exit"
  ]
}
