{
  "html_path": "output/index.html",
  "asset_paths": [
    "output/assets/bg_library_messy_lobby.webp",
    "output/assets/bg_library_clean_lobby.webp",
    "output/assets/kid_librarian_idle.webp",
    "output/assets/kid_librarian_success.webp",
    "output/assets/kid_librarian_confused.webp",
    "output/assets/kid_librarian_explaining.webp",
    "output/assets/teacher_worried.webp",
    "output/assets/teacher_pointing.webp",
    "output/assets/teacher_happy.webp",
    "output/assets/wall_clock_body.webp",
    "output/assets/table_clock_body.webp",
    "output/assets/cork_schedule_board.webp",
    "output/assets/library_monitor_body.webp",
    "output/assets/storybook_base.webp",
    "output/assets/story_page_convenience_24.webp",
    "output/assets/story_page_sundial.webp",
    "output/assets/story_page_oven_timer.webp",
    "output/assets/certificate_paper.webp",
    "output/assets/golden_repair_ticket_button_blank.webp",
    "output/assets/library_dialogue_plaque_blank.webp",
    "output/assets/ticket_time_choice_blank.webp",
    "output/assets/repair_workbench_mat_blank.webp",
    "output/assets/next_lesson_invitation_ticket_blank.webp",
    "output/assets/number_block_blank_physical_tile.webp",
    "output/assets/cork_input_number_slot_blank.webp",
    "output/assets/library_feedback_status_tag_blank.webp"
  ],
  "implemented_sections": [
    "section_title",
    "section_problem_intro",
    "section_tutorial_clock",
    "section_tutorial_success",
    "section_mission_type_a",
    "section_mission_type_b",
    "section_mission_type_c",
    "section_repair_outro",
    "section_story_gallery",
    "section_popup_quiz",
    "section_final_certificate"
  ],
  "implemented_interactions": [
    "start_button",
    "hamburger_lesson_menu",
    "energy_gauge",
    "tutorial_drag_clock_card",
    "next_to_mission_button",
    "type_a_clock_choice",
    "type_b_keypad_input",
    "type_c_number_drag_drop",
    "repair_to_story_button",
    "storybook_carousel",
    "popup_quiz_choice",
    "certificate_save_button",
    "next_lesson_route_button"
  ]
}
