{
  "html_path": "output/index.html",
  "asset_paths": [
    "output/assets/library_lobby_broken.png",
    "output/assets/library_lobby_restored.png",
    "output/assets/clock_body_large.png",
    "output/assets/clock_body_small.png",
    "output/assets/clock_desk_scene.png",
    "output/assets/reading_class_scene.png",
    "output/assets/loan_desk_scene.png",
    "output/assets/day_night_timeline.png",
    "output/assets/magic_book_surface.png",
    "output/assets/convenience_store_24h.png",
    "output/assets/sundial_example.png",
    "output/assets/oven_timer_example.png",
    "output/assets/certificate_paper.png",
    "output/assets/child_librarian_idle.png",
    "output/assets/child_librarian_confident.png",
    "output/assets/child_librarian_success.png",
    "output/assets/child_librarian_confused.png",
    "output/assets/teacher_librarian_worried.png",
    "output/assets/teacher_librarian_explaining.png",
    "output/assets/teacher_librarian_success.png",
    "output/assets/shared_repair_ticket_body.png",
    "output/assets/title_repair_request_board.png",
    "output/assets/tutorial_repair_workbench.png",
    "output/assets/clock_choice_rack.png",
    "output/assets/reading_class_keypad_console.png",
    "output/assets/loan_terminal_block_console.png",
    "output/assets/final_quiz_console.png",
    "output/assets/activity_text_choice_rack.png",
    "output/assets/repair_energy_meter_body.png",
    "output/assets/reading_class_prompt_note.png",
    "output/assets/magic_book_page_tab.png",
    "output/assets/feedback_stamp_body.png",
    "output/assets/tutorial_prompt_plate.png",
    "output/assets/clock_crisis_effects.png"
  ],
  "implemented_sections": [
    "activity1_scene1_title",
    "activity1_scene2_problem",
    "activity1_scene3_tutorial",
    "activity1_scene4_success",
    "activity2_global",
    "activity2_scene1_type_a",
    "activity2_scene2_type_b",
    "activity2_scene3_type_c",
    "activity2_scene4_outro",
    "activity3_scene1_gallery",
    "activity3_scene2_quiz",
    "activity3_scene3_certificate"
  ],
  "implemented_interactions": [
    "interaction_start",
    "interaction_hamburger_menu",
    "interaction_clock_spin",
    "interaction_tutorial_drag",
    "interaction_success_transition",
    "interaction_activity2_progress",
    "interaction_type_a_choice",
    "interaction_attempt_limit",
    "interaction_type_b_keypad",
    "interaction_type_b_choice",
    "interaction_type_c_drag",
    "interaction_type_c_choice",
    "interaction_library_restore",
    "interaction_story_transition",
    "interaction_gallery_pages",
    "interaction_final_quiz",
    "interaction_final_progress",
    "interaction_save_certificate",
    "interaction_next_lesson"
  ]
}
