{
  "html_path": "output/index.html",
  "asset_paths": [
    "output/assets/station_chaos.png",
    "output/assets/clerk_anxious.png",
    "output/assets/broken_display.png",
    "output/assets/ticket_machine_closeup.png",
    "output/assets/number_cards.png",
    "output/assets/customer_ticket_success.png",
    "output/assets/repair_system_bg.png",
    "output/assets/slot_problem_board.png",
    "output/assets/boss_choice_passengers.png",
    "output/assets/station_calm.png",
    "output/assets/life_queue_examples.png",
    "output/assets/golden_ticket_reward.png"
  ],
  "implemented_sections": [
    "step1_intro_problem",
    "step2_tutorial_repair",
    "step3_game_repair",
    "step4_life_story",
    "step4_completion_reward"
  ],
  "implemented_interactions": [
    "intro_start_button",
    "zoom_to_ticket_machine",
    "tutorial_card_place",
    "tutorial_answer_feedback",
    "step2_next_button",
    "game_problem_sequence",
    "keypad_number_input",
    "place_value_hint_feedback",
    "boss_largest_number_choice",
    "life_example_slideshow",
    "completion_stamp_reward",
    "next_lesson_button"
  ]
}
