{
  "html_path": "output/index.html",
  "asset_paths": [
    "output/assets/station_ticket_pouch_states.png",
    "output/assets/station_chaos.png",
    "output/assets/station_machine_zoom_bridge.png",
    "output/assets/stationmaster_worried.png",
    "output/assets/ticket_machine_broken.png",
    "output/assets/repair_error_layers.png",
    "output/assets/digit_place_highlight_sprites.png",
    "output/assets/passenger_ticket_success.png",
    "output/assets/repair_system_background.png",
    "output/assets/number_panel_game.png",
    "output/assets/ticket_slot_console.png",
    "output/assets/station_fixed.png",
    "output/assets/stationmaster_happy.png",
    "output/assets/life_waiting_examples.png",
    "output/assets/golden_ticket_reward.png"
  ],
  "implemented_sections": [
    "section_intro_problem",
    "section_tutorial_repair",
    "section_practice_game",
    "section_story_resolution",
    "section_completion_next"
  ],
  "implemented_interactions": [
    "interaction_start_zoom",
    "interaction_tutorial_cards",
    "interaction_next_after_tutorial",
    "interaction_practice_keypad",
    "interaction_boss_compare",
    "interaction_life_slide",
    "interaction_completion_next"
  ]
}
