{
  "html_path": "output/index.html",
  "asset_paths": [
    "output/assets/bg_messy_library_lobby.png",
    "output/assets/character_teacher_worried.png",
    "output/assets/object_table_clock_3_oclock.png",
    "output/assets/character_child_librarian_confident.png",
    "output/assets/character_child_librarian_success.png",
    "output/assets/character_teacher_happy.png",
    "output/assets/bg_clock_counter_station.png",
    "output/assets/character_child_librarian_idle.png",
    "output/assets/bg_reading_timetable_board.png",
    "output/assets/bg_loan_system_monitor.png",
    "output/assets/bg_restored_library_lobby.png",
    "output/assets/effect_golden_repair_particles.png",
    "output/assets/character_teacher_explaining.png",
    "output/assets/story_convenience_24h_sign.png",
    "output/assets/story_sundial_shadow.png",
    "output/assets/story_oven_30min_timer.png",
    "output/assets/object_repair_certificate.png"
  ],
  "implemented_sections": [
    "sec_intro_title",
    "sec_problem_intro",
    "sec_tutorial_clock",
    "sec_tutorial_success",
    "sec_mission_type_a",
    "sec_mission_type_b",
    "sec_mission_type_c",
    "sec_repair_outro",
    "sec_real_life_story",
    "sec_popup_quiz",
    "sec_final_certificate"
  ],
  "implemented_interactions": [
    "int_start_button",
    "int_hamburger_menu",
    "int_tutorial_drag_clock",
    "int_step2_transition",
    "int_clock_choice_quiz",
    "int_keypad_time_input",
    "int_number_block_drag",
    "int_story_transition",
    "int_storybook_pages",
    "int_popup_quiz",
    "int_certificate_actions"
  ]
}
